{
  "schemaVersion": "wayline.v1",
  "batchId": "batch-001",
  "itemCount": 3,
  "firstPassWrongCount": 2,
  "finalCorrectCount": 3,
  "revisionUsed": true,
  "items": [
    {
      "itemId": "item-001",
      "firstSelection": {"optionId": "opt-001-b", "confidence": "leaning", "isCorrect": false},
      "finalSelection": {"optionId": "opt-001-a", "confidence": "certain", "isCorrect": true},
      "correctOptionId": "opt-001-a",
      "correctAnswer": "2.75",
      "trustedSteps": ["Align the decimal points.", "Add each place value to get 2.75."],
      "possibleError": "This answer can come from aligning the digits by their ends instead of by place value.",
      "reliableMethod": "Align the decimal points first, then add by place value.",
      "selfCorrected": true
    },
    {
      "itemId": "item-002",
      "firstSelection": {"optionId": "opt-002-a", "confidence": "certain", "isCorrect": true},
      "finalSelection": {"optionId": "opt-002-a", "confidence": "certain", "isCorrect": true},
      "correctOptionId": "opt-002-a",
      "correctAnswer": "12",
      "trustedSteps": ["Use the related multiplication fact: 7 times 12 is 84."],
      "possibleError": null,
      "reliableMethod": "Check division with the related multiplication fact.",
      "selfCorrected": false
    },
    {
      "itemId": "item-003",
      "firstSelection": {"optionId": "opt-003-b", "confidence": "guessing", "isCorrect": false},
      "finalSelection": {"optionId": "opt-003-a", "confidence": "leaning", "isCorrect": true},
      "correctOptionId": "opt-003-a",
      "correctAnswer": "27",
      "trustedSteps": ["Write 30 percent as 0.30.", "Multiply 0.30 by 90 to get 27."],
      "possibleError": "This answer can come from dividing the percent by 10 without applying it to the amount.",
      "reliableMethod": "Convert the percent to a decimal, then multiply by the amount.",
      "selfCorrected": true
    }
  ]
}
